{"$id":"urn:rd22:step11:sp1-07:expected-ledger:v001","$schema":"https://json-schema.org/draft/2020-12/schema","additionalProperties":false,"properties":{"entries":{"items":{"additionalProperties":false,"properties":{"derivation_id":{"enum":["D01_SHARED_BOUNDARY_DESCENT","D02_THREE_CELL_LEFT_PARENTHESIZATION","D03_THREE_CELL_RIGHT_PARENTHESIZATION","D04_CELL_ORDER_INDEPENDENCE","D05_PRIMITIVE_SHARED_SUPPORT_OVERLAP","D06_GRADED_RECORD_FACTOR_COMMUTATION","D07_VERTEX_RELABELING_COVARIANCE","D08_ORIENTATION_REVERSAL_COVARIANCE","D09_FINITE_STONE_ORDERING"]},"expected_conclusion":{"type":"object"}},"required":["derivation_id","expected_conclusion"],"type":"object"},"maxItems":9,"minItems":9,"type":"array"},"required_ids":{"const":["D01_SHARED_BOUNDARY_DESCENT","D02_THREE_CELL_LEFT_PARENTHESIZATION","D03_THREE_CELL_RIGHT_PARENTHESIZATION","D04_CELL_ORDER_INDEPENDENCE","D05_PRIMITIVE_SHARED_SUPPORT_OVERLAP","D06_GRADED_RECORD_FACTOR_COMMUTATION","D07_VERTEX_RELABELING_COVARIANCE","D08_ORIENTATION_REVERSAL_COVARIANCE","D09_FINITE_STONE_ORDERING"]},"row_id":{"const":"C-B-V011-SP1-07"},"schema":{"const":"rd22.step11.sp1-07.expected-ledger.v001"}},"required":["schema","row_id","required_ids","entries"],"title":"SP1-07 closed nonempty expected ledger","type":"object"}