{"entries":[{"derivation_id":"D01_SHARED_BOUNDARY_DESCENT","expected_conclusion":{"distinct_even_record_factors":true,"global_operator":"h_K=sum_c P_c tensor gamma^5 tensor iota_c(c_c)","one_global_source_car":"CAR(K_Sigma)","predicate":"SHARED_BOUNDARY_DESCENT","shared_vertices_identified_once_by_pushout":true}},{"derivation_id":"D02_THREE_CELL_LEFT_PARENTHESIZATION","expected_conclusion":{"parenthesization":"PUSHOUT(PUSHOUT(c1,c2),c3)","predicate":"THREE_CELL_GLOBAL_ASSEMBLY","result":"h_K(c1,c2,c3)"}},{"derivation_id":"D03_THREE_CELL_RIGHT_PARENTHESIZATION","expected_conclusion":{"parenthesization":"PUSHOUT(c1,PUSHOUT(c2,c3))","predicate":"THREE_CELL_GLOBAL_ASSEMBLY","result":"h_K(c1,c2,c3)"}},{"derivation_id":"D04_CELL_ORDER_INDEPENDENCE","expected_conclusion":{"predicate":"CELL_ORDER_INDEPENDENCE","result":"ASSEMBLY(order_1)=ASSEMBLY(order_2)=h_K"}},{"derivation_id":"D05_PRIMITIVE_SHARED_SUPPORT_OVERLAP","expected_conclusion":{"formula":"Tr(P_c P_d)=|<d_c,d_d>|^2/(||d_c||^2 ||d_d||^2)","h_K_off_diagonal":true,"h_K_squared_not_primitive":true,"orientation_sign_independent":true,"predicate":"PRIMITIVE_SHARED_SUPPORT_OVERLAP"}},{"derivation_id":"D06_GRADED_RECORD_FACTOR_COMMUTATION","expected_conclusion":{"predicate":"GRADED_RECORD_FACTOR_COMMUTATION","result":"[iota_c(x),iota_d(y)]_graded=0 for c!=d and even x,y"}},{"derivation_id":"D07_VERTEX_RELABELING_COVARIANCE","expected_conclusion":{"predicate":"VERTEX_RELABELING_COVARIANCE","result":"h_relabel=P_source h_K P_source^-1"}},{"derivation_id":"D08_ORIENTATION_REVERSAL_COVARIANCE","expected_conclusion":{"predicate":"ORIENTATION_REVERSAL_COVARIANCE","result":"h_reversed=U_record h_K U_record^-1"}},{"derivation_id":"D09_FINITE_STONE_ORDERING","expected_conclusion":{"predicate":"FINITE_STONE_ORDERING","result":"U_K(t+s)=U_K(t)U_K(s), U_K(t)=exp(-itH_K), unique"}}],"required_ids":["D01_SHARED_BOUNDARY_DESCENT","D02_THREE_CELL_LEFT_PARENTHESIZATION","D03_THREE_CELL_RIGHT_PARENTHESIZATION","D04_CELL_ORDER_INDEPENDENCE","D05_PRIMITIVE_SHARED_SUPPORT_OVERLAP","D06_GRADED_RECORD_FACTOR_COMMUTATION","D07_VERTEX_RELABELING_COVARIANCE","D08_ORIENTATION_REVERSAL_COVARIANCE","D09_FINITE_STONE_ORDERING"],"row_id":"C-B-V011-SP1-07","schema":"rd22.step11.sp1-07.expected-ledger.v001"}